{
  "document_id": "doc_123",
  "client_id": "client_123",
  "competence_id": "competence_2026_05",
  "filename": "doc_123.pdf",
  "original_filename": "balancete_maio_2026.pdf",
  "extension": ".pdf",
  "mime_type": "application/pdf",
  "size_bytes": 245760,
  "sha256_hash": "aaaaaaaaaaaaaaaaaaaaaaaaaaaaaaaaaaaaaaaaaaaaaaaaaaaaaaaaaaaaaaaa",
  "storage_bucket": "raw-documents",
  "storage_key": "client_123/2026-05/doc_123.pdf",
  "document_type": "balancete",
  "status": "confirmed",
  "classification_confidence": 0.98,
  "created_at": "2026-05-01T10:00:00Z",
  "updated_at": "2026-05-01T10:02:00Z",
  "metadata": { "source": "manual_upload" }
}
